{
  "schema_version": "1.0.0",
  "type": "race_watch",
  "ok": false,
  "generated_at": "2026-10-19T12:00:00Z",
  "projection_revision": "pr_00000000-0000-4000-8000-000000000001",
  "years": [
    "2026",
    "2027"
  ],
  "period": {
    "from": null,
    "to": "2026-10-19T12:00:00Z",
    "mode": "full_retained_history"
  },
  "coverage": {
    "availability": "unavailable",
    "completeness": "unknown",
    "history_complete_since": null,
    "years": [
      {
        "year": "2026",
        "availability": "unavailable",
        "completeness": "unknown",
        "history_complete_since": null
      },
      {
        "year": "2027",
        "availability": "unavailable",
        "completeness": "unknown",
        "history_complete_since": null
      }
    ],
    "reasons": [
      "upstream_timeout"
    ]
  },
  "editions": [],
  "revisions": [],
  "error": {
    "code": "UPSTREAM_UNAVAILABLE",
    "retryable": true
  }
}
